{
  "$schema": "http://json-schema.org/draft-07/schema#",
  "type": "object",
  "required": [
    "APP_ENV",
    "APP_DEBUG",
    "OPENAI_API_KEY",
    "OPENAI_MODEL",
    "OPENAI_MAX_TOKENS",
    "STORAGE_BUCKET_NAME",
    "GCP_PROJECT_ID"
  ],
  "properties": {
    "APP_ENV": {
      "type": "string",
      "enum": ["development", "production", "test"],
      "description": "Application environment"
    },
    "APP_DEBUG": {
      "type": "boolean",
      "description": "Debug mode flag"
    },
    "OPENAI_API_KEY": {
      "type": "string",
      "pattern": "^sk-[a-zA-Z0-9]{48}$",
      "description": "OpenAI API key"
    },
    "OPENAI_MODEL": {
      "type": "string",
      "enum": ["gpt-3.5-turbo", "gpt-4", "gpt-4-turbo-preview"],
      "default": "gpt-3.5-turbo",
      "description": "OpenAI model to use"
    },
    "OPENAI_MAX_TOKENS": {
      "type": "integer",
      "minimum": 100,
      "maximum": 2000,
      "default": 500,
      "description": "Maximum tokens for summary"
    },
    "STORAGE_BUCKET_NAME": {
      "type": "string",
      "pattern": "^[a-z0-9][a-z0-9._-]{1,61}[a-z0-9]$",
      "description": "Google Cloud Storage bucket name"
    },
    "GCP_PROJECT_ID": {
      "type": "string",
      "pattern": "^[a-z][a-z0-9-]{4,28}[a-z0-9]$",
      "description": "Google Cloud project ID"
    },
    "GOOGLE_APPLICATION_CREDENTIALS": {
      "type": "string",
      "description": "Path to Google Cloud credentials JSON file"
    }
  }
}