{
  "APP_ENV": "test",
  "APP_DEBUG": true,
  "OPENAI_API_KEY": "sk-test000000000000000000000000000000000000000000000",
  "OPENAI_MODEL": "gpt-3.5-turbo",
  "OPENAI_MAX_TOKENS": 500,
  "STORAGE_BUCKET_NAME": "test-bucket",
  "GCP_PROJECT_ID": "test-project",
  "GOOGLE_APPLICATION_CREDENTIALS": "/dev/null"
}